prof_name,traits
Тестировщик,Внимательность к деталям. Терпимость и терпение. Аналитический склад ума. Коммуникабельность. Ориентированность на результат. Умение работать в команде. Стрессоустойчивость
Бизнес-информатик,Аналитический склад ума. Владение техническими навыками. Интерес к работе с данными. Владение коммуникативными навыками. Ориентированность на результат. Готовность к обучению и развитию. Интерес к бизнесу. Умение управлять проектами
Системный администратор,Технический склад ума. Аналитическое мышление. Ответственность. Коммуникабельность. Способность к обучению. Организованность. Стрессоустойчивость. Интерес к технологиям. Системное мышление. Интерес к безопасности
Разработчик игр,Творческое мышление. Внимание к деталям. Навыки командной работы. Способность к критическому анализу. Терпимость к стрессу. Непрерывное обучение. Решительность. Способность к долгосрочной концентрации
Data Scientist,Аналитический склад ума. Интерес к математике. Программирование. Интерес к работе с данными. Креативность и инновационное мышление. Бизнес-ориентированность. Коммуникационные навыки. Интерес к области данных
UI/UX дизайнер,Креативность. Интерес к пользовательскому опыту. Визуальное мышление. Аналитические навыки. Коммуникативные навыки. Обучаемость и адаптивность
Системный аналитик,Аналитический склад ума. Умение следить за тенденциями. Владение техническими навыками. Умение моделировать системы. Способность постоянно обучаться
SEO-специалист,Умение анализировать ключевые слова. Способность производить технический аудит сайта. Интерес к участию в разработке и обновлении сайта. Умение соблюдать рекомендации поисковых систем
Инженер-математик,Технический склад ума. Cпособность производить математическое моделирование. Интерес к разработкам и проведению исследований
DevOps-инженер,Технический склад ума. Умение решать проблемы. Способность к обучению. Внимание к деталям
Разработчик мобильных приложений,Любовь к программированию. Техническое мышление. Творческий взгляд на вещи. Умение работать в команде. Терпение и решительность. Аналитические навыки. Стремление к обучению. Интерес к пользовательскому опыту. Знание языков программирования
Технический писатель,Технический склад ума. Умение упрощать сложную информацию. Способность осуществлять корректуру и редактирование существующих документов
Системный программист,Любовь к программированию. Техническое мышление. Умение работать с системным ПО. Способность осуществлять техническую поддержку и консультирование
VR-разработчик,Креативность. Технические навыки. Умение решать проблемы. Внимание к деталям. Способность к обучению. Коммуникативные навыки. Терпение и настойчивость. Адаптивность. Проектное мышление. Ориентация на пользователя
Web-программист,Интерес к IT. Логическое мышление. Терпимость к ошибкам и упорство. Творческое мышление. Умение работать в команде. Самодисциплина и самостоятельность. Готовность к решению проблем. Интерес к деталям. Коммуникабельность. Стремление к обучению
Специалист по защите информации,Способность проводить анализ угроз и рисков. Внимание к деталям. Умение проводить инцедентный менеджмент
QA-инженер,Аналитический склад ума. Точность и внимательность к деталям. Желание учиться и совершенствоваться. Коммуникабельность. Умение работать в команде. Ответственность. Умение решать проблемы
Этичный хакер,Аналитический склад ума. Внимание к деталям. Инициативность. Этичность. Способность к обучению. Стрессоустойчивость
Специалист по машинному обучению,Любознательность. Интерес к математике и программированию. Логическое мышление. Способность работать с информацией. Творческое мышление
Системный архитектор,Аналитический склад ума. Способность разрабатывать архитектурные решения. Умение оценивать и управлять рисками. Способность обновлять и модернизировать системы
Блокчейн-разработчик,Увлеченность технологиями. Аналитический склад ума. Внимание к деталям. Умение решать проблемы. Математические навыки. Коммуникативные навыки. Терпение и упорство. Инновационность. Самостоятельность. Способность работать в команде. Этика и ответственность
Программист микроконтроллеров,Любовь к программированию. Техническое мышление. Умение работать с переферийными устройствами. Способность осуществлять оптимизацию кода и ресурсов
